{
 "schema": "nuit.guitar-performance/1",
 "engine": {
  "name": "nuit-transcriber",
  "version": "0.1.0",
  "models": {
   "source": "synthetic"
  }
 },
 "source": {
  "kind": "synthetic",
  "id": "estudio-sintetico-la-menor",
  "url": null,
  "title": "Estudio sintético en La menor (Nuit One demo)",
  "uploader": "Nuit One",
  "durationSec": 18.667,
  "uploadDate": null,
  "license": "AGPL-3.0-only (original demo material)",
  "hasVideo": false,
  "videoSize": null
 },
 "instrument": {
  "family": "guitar",
  "variant": "classical",
  "twinRef": "preset:classical-650",
  "geometry": {
   "scaleLengthMm": 650.0,
   "fretCount": 19,
   "fretsToBody": 12,
   "nutWidthMm": 52.0,
   "widthAtBodyJointMm": 62.0,
   "stringSpreadNutMm": 43.0,
   "stringSpreadSaddleMm": 58.0,
   "fingerboardRadiusMm": null,
   "inlayFrets": [],
   "fretPositionsMm": [
    0.0,
    36.482,
    70.916,
    103.417,
    134.095,
    163.05,
    190.381,
    216.177,
    240.526,
    263.508,
    285.2,
    305.674,
    325.0,
    343.241,
    360.458,
    376.709,
    392.047,
    406.525,
    420.19,
    433.089
   ],
   "strings": [
    {
     "stringNumber": 6,
     "openMidi": 40,
     "nut": [
      0.0,
      -21.5
     ],
     "saddle": [
      650.0,
      -29.0
     ]
    },
    {
     "stringNumber": 5,
     "openMidi": 45,
     "nut": [
      0.0,
      -12.9
     ],
     "saddle": [
      650.0,
      -17.4
     ]
    },
    {
     "stringNumber": 4,
     "openMidi": 50,
     "nut": [
      0.0,
      -4.3
     ],
     "saddle": [
      650.0,
      -5.8
     ]
    },
    {
     "stringNumber": 3,
     "openMidi": 55,
     "nut": [
      0.0,
      4.3
     ],
     "saddle": [
      650.0,
      5.8
     ]
    },
    {
     "stringNumber": 2,
     "openMidi": 59,
     "nut": [
      0.0,
      12.9
     ],
     "saddle": [
      650.0,
      17.4
     ]
    },
    {
     "stringNumber": 1,
     "openMidi": 64,
     "nut": [
      0.0,
      21.5
     ],
     "saddle": [
      650.0,
      29.0
     ]
    }
   ]
  },
  "tuning": {
   "name": "standard",
   "openMidi": [
    40,
    45,
    50,
    55,
    59,
    64
   ],
   "referenceHz": 440.0,
   "capo": 0,
   "offsetCents": 0.0,
   "intonationSpreadCents": 0.0
  }
 },
 "timing": {
  "source": "synthetic",
  "beats": [
   0.0,
   0.6667,
   1.3333,
   2.0,
   2.6667,
   3.3333,
   4.0,
   4.6667,
   5.3333,
   6.0,
   6.6667,
   7.3333,
   8.0,
   8.6667,
   9.3333,
   10.0,
   10.6667,
   11.3333,
   12.0,
   12.6667,
   13.3333,
   14.0,
   14.6667,
   15.3333,
   16.0,
   16.6667,
   17.3333,
   18.0,
   18.6667
  ],
  "downbeats": [
   0.0,
   2.6667,
   5.3333,
   8.0,
   10.6667,
   13.3333,
   16.0,
   18.6667
  ],
  "beatsPerBar": 4,
  "beatUnit": 4,
  "tempoBpm": 90.0,
  "tempoCurve": [
   [
    0.0,
    90.0
   ],
   [
    0.6667,
    90.0
   ],
   [
    1.3333,
    90.0
   ],
   [
    2.0,
    90.0
   ],
   [
    2.6667,
    90.0
   ],
   [
    3.3333,
    90.0
   ],
   [
    4.0,
    90.0
   ],
   [
    4.6667,
    90.0
   ],
   [
    5.3333,
    90.0
   ],
   [
    6.0,
    90.0
   ],
   [
    6.6667,
    90.0
   ],
   [
    7.3333,
    90.0
   ],
   [
    8.0,
    90.0
   ],
   [
    8.6667,
    90.0
   ],
   [
    9.3333,
    90.0
   ],
   [
    10.0,
    90.0
   ],
   [
    10.6667,
    90.0
   ],
   [
    11.3333,
    90.0
   ],
   [
    12.0,
    90.0
   ],
   [
    12.6667,
    90.0
   ],
   [
    13.3333,
    90.0
   ],
   [
    14.0,
    90.0
   ],
   [
    14.6667,
    90.0
   ],
   [
    15.3333,
    90.0
   ],
   [
    16.0,
    90.0
   ],
   [
    16.6667,
    90.0
   ],
   [
    17.3333,
    90.0
   ],
   [
    18.0,
    90.0
   ]
  ],
  "firstBarStart": 0.0,
  "rubatoIndex": 0.0
 },
 "notes": [
  {
   "id": 0,
   "onset": 0.0,
   "offset": 2.6667,
   "midi": 45,
   "cents": 0.0,
   "velocity": 64,
   "confidence": 1.0,
   "string": 5,
   "fret": 0,
   "lhFinger": 0,
   "rhFinger": "p",
   "voice": 2,
   "event": 0,
   "measure": 1,
   "beat": 0.0,
   "beatQuantized": "0",
   "durationBeats": "4",
   "timingDeviationBeats": 0.0,
   "barre": null,
   "techniques": [
    {
     "kind": "let-ring",
     "confidence": 1.0
    }
   ],
   "dynamic": "mp",
   "articulation": "legato",
   "timbre": "ordinario",
   "flags": []
  },
  {
   "id": 1,
   "onset": 0.3333,
   "offset": 0.6667,
   "midi": 57,
   "cents": 0.0,
   "velocity": 64,
   "confidence": 1.0,
   "string": 3,
   "fret": 2,
   "lhFinger": 2,
   "rhFinger": "i",
   "voice": 1,
   "event": 1,
   "measure": 1,
   "beat": 0.5,
   "beatQuantized": "1/2",
   "durationBeats": "1/2",
   "timingDeviationBeats": 0.0,
   "barre": null,
   "techniques": [],
   "dynamic": "mp",
   "articulation": "legato",
   "timbre": "ordinario",
   "flags": []
  },
  {
   "id": 2,
   "onset": 0.6667,
   "offset": 1.0,
   "midi": 60,
   "cents": 0.0,
   "velocity": 64,
   "confidence": 1.0,
   "string": 2,
   "fret": 1,
   "lhFinger": 1,
   "rhFinger": "m",
   "voice": 1,
   "event": 2,
   "measure": 1,
   "beat": 1.0,
   "beatQuantized": "1",
   "durationBeats": "1/2",
   "timingDeviationBeats": 0.0,
   "barre": null,
   "techniques": [],
   "dynamic": "mp",
   "articulation": "legato",
   "timbre": "ordinario",
   "flags": []
  },
  {
   "id": 3,
   "onset": 1.0,
   "offset": 1.3333,
   "midi": 64,
   "cents": 0.0,
   "velocity": 64,
   "confidence": 1.0,
   "string": 1,
   "fret": 0,
   "lhFinger": 0,
   "rhFinger": "a",
   "voice": 1,
   "event": 3,
   "measure": 1,
   "beat": 1.5,
   "beatQuantized": "3/2",
   "durationBeats": "1/2",
   "timingDeviationBeats": 0.0,
   "barre": null,
   "techniques": [],
   "dynamic": "mp",
   "articulation": "legato",
   "timbre": "ordinario",
   "flags": []
  },
  {
   "id": 4,
   "onset": 1.3333,
   "offset": 1.6667,
   "midi": 60,
   "cents": 0.0,
   "velocity": 64,
   "confidence": 1.0,
   "string": 2,
   "fret": 1,
   "lhFinger": 1,
   "rhFinger": "m",
   "voice": 1,
   "event": 4,
   "measure": 1,
   "beat": 2.0,
   "beatQuantized": "2",
   "durationBeats": "1/2",
   "timingDeviationBeats": 0.0,
   "barre": null,
   "techniques": [],
   "dynamic": "mp",
   "articulation": "legato",
   "timbre": "ordinario",
   "flags": []
  },
  {
   "id": 5,
   "onset": 1.6667,
   "offset": 2.0,
   "midi": 57,
   "cents": 0.0,
   "velocity": 64,
   "confidence": 1.0,
   "string": 3,
   "fret": 2,
   "lhFinger": 2,
   "rhFinger": "i",
   "voice": 1,
   "event": 5,
   "measure": 1,
   "beat": 2.5,
   "beatQuantized": "5/2",
   "durationBeats": "1/2",
   "timingDeviationBeats": 0.0,
   "barre": null,
   "techniques": [],
   "dynamic": "mp",
   "articulation": "legato",
   "timbre": "ordinario",
   "flags": []
  },
  {
   "id": 6,
   "onset": 2.0,
   "offset": 2.3333,
   "midi": 60,
   "cents": 0.0,
   "velocity": 64,
   "confidence": 1.0,
   "string": 2,
   "fret": 1,
   "lhFinger": 1,
   "rhFinger": "m",
   "voice": 1,
   "event": 6,
   "measure": 1,
   "beat": 3.0,
   "beatQuantized": "3",
   "durationBeats": "1/2",
   "timingDeviationBeats": 0.0,
   "barre": null,
   "techniques": [],
   "dynamic": "mp",
   "articulation": "legato",
   "timbre": "ordinario",
   "flags": []
  },
  {
   "id": 7,
   "onset": 2.3333,
   "offset": 2.6667,
   "midi": 57,
   "cents": 0.0,
   "velocity": 64,
   "confidence": 1.0,
   "string": 3,
   "fret": 2,
   "lhFinger": 2,
   "rhFinger": "i",
   "voice": 1,
   "event": 7,
   "measure": 1,
   "beat": 3.5,
   "beatQuantized": "7/2",
   "durationBeats": "1/2",
   "timingDeviationBeats": 0.0,
   "barre": null,
   "techniques": [],
   "dynamic": "mp",
   "articulation": "legato",
   "timbre": "ordinario",
   "flags": []
  },
  {
   "id": 8,
   "onset": 2.6667,
   "offset": 5.3333,
   "midi": 45,
   "cents": 0.0,
   "velocity": 64,
   "confidence": 1.0,
   "string": 5,
   "fret": 0,
   "lhFinger": 0,
   "rhFinger": "p",
   "voice": 2,
   "event": 8,
   "measure": 2,
   "beat": 0.0,
   "beatQuantized": "0",
   "durationBeats": "4",
   "timingDeviationBeats": 0.0,
   "barre": null,
   "techniques": [
    {
     "kind": "let-ring",
     "confidence": 1.0
    }
   ],
   "dynamic": "mp",
   "articulation": "legato",
   "timbre": "ordinario",
   "flags": []
  },
  {
   "id": 9,
   "onset": 3.0,
   "offset": 3.3333,
   "midi": 57,
   "cents": 0.0,
   "velocity": 64,
   "confidence": 1.0,
   "string": 3,
   "fret": 2,
   "lhFinger": 2,
   "rhFinger": "i",
   "voice": 1,
   "event": 9,
   "measure": 2,
   "beat": 0.5,
   "beatQuantized": "1/2",
   "durationBeats": "1/2",
   "timingDeviationBeats": 0.0,
   "barre": null,
   "techniques": [],
   "dynamic": "mp",
   "articulation": "legato",
   "timbre": "ordinario",
   "flags": []
  },
  {
   "id": 10,
   "onset": 3.3333,
   "offset": 3.6667,
   "midi": 60,
   "cents": 0.0,
   "velocity": 64,
   "confidence": 1.0,
   "string": 2,
   "fret": 1,
   "lhFinger": 1,
   "rhFinger": "m",
   "voice": 1,
   "event": 10,
   "measure": 2,
   "beat": 1.0,
   "beatQuantized": "1",
   "durationBeats": "1/2",
   "timingDeviationBeats": 0.0,
   "barre": null,
   "techniques": [],
   "dynamic": "mp",
   "articulation": "legato",
   "timbre": "ordinario",
   "flags": []
  },
  {
   "id": 11,
   "onset": 3.6667,
   "offset": 4.0,
   "midi": 64,
   "cents": 0.0,
   "velocity": 64,
   "confidence": 1.0,
   "string": 1,
   "fret": 0,
   "lhFinger": 0,
   "rhFinger": "a",
   "voice": 1,
   "event": 11,
   "measure": 2,
   "beat": 1.5,
   "beatQuantized": "3/2",
   "durationBeats": "1/2",
   "timingDeviationBeats": 0.0,
   "barre": null,
   "techniques": [],
   "dynamic": "mp",
   "articulation": "legato",
   "timbre": "ordinario",
   "flags": []
  },
  {
   "id": 12,
   "onset": 4.0,
   "offset": 4.3333,
   "midi": 60,
   "cents": 0.0,
   "velocity": 64,
   "confidence": 1.0,
   "string": 2,
   "fret": 1,
   "lhFinger": 1,
   "rhFinger": "m",
   "voice": 1,
   "event": 12,
   "measure": 2,
   "beat": 2.0,
   "beatQuantized": "2",
   "durationBeats": "1/2",
   "timingDeviationBeats": 0.0,
   "barre": null,
   "techniques": [],
   "dynamic": "mp",